{
  "schema_version": 1,
  "host": {
    "runtime_entrypoint": "ohmymeme.app.bootstrap",
    "updater_entrypoints": [
      "check_latest_cached",
      "start_download",
      "run_downloaded_installer"
    ],
    "manifest_path": "ohmymeme/config/plugin-manifest.json",
    "manifest_sha256": "d39856002f56a78347f5a337113e280a08ab94a74537d841e398e84d3b4087a2"
  },
  "release_catalog": {
    "verdict": "pass",
    "releases": [
      {
        "version": "0.6.3",
        "channel": "stable",
        "prerelease": false,
        "assets": [
          {
            "platform": "windows-x86_64",
            "asset_name": "OhMyMeme-0.6.3-setup.exe",
            "asset_url": "https://example.invalid/releases/0.6.3/OhMyMeme-0.6.3-setup.exe",
            "sha256": "102e01e382b2efb94ba4edd0ef57441b890d20ec5863896857835bb699b8ddca",
            "architecture": "x64"
          },
          {
            "platform": "linux-x86_64-appimage",
            "asset_name": "OhMyMeme-v0.6.3-x86_64.AppImage",
            "asset_url": "https://example.invalid/releases/0.6.3/OhMyMeme-v0.6.3-x86_64.AppImage",
            "sha256": "18dbe3e430c2ed204f2feffc0bd4cab2ffda10aa9bb7bf98a16c18aee3e2c180",
            "architecture": "x86_64"
          },
          {
            "platform": "linux-x86_64-deb",
            "asset_name": "OhMyMeme-v0.6.3-amd64.deb",
            "asset_url": "https://example.invalid/releases/0.6.3/OhMyMeme-v0.6.3-amd64.deb",
            "sha256": "49968791855bb896d938d06f766b34ec23e69315826c37e810c9e0b8cac4f241",
            "architecture": "amd64"
          },
          {
            "platform": "linux-x86_64-rpm",
            "asset_name": "OhMyMeme-v0.6.3-x86_64.rpm",
            "asset_url": "https://example.invalid/releases/0.6.3/OhMyMeme-v0.6.3-x86_64.rpm",
            "sha256": "8f10ae0c5def43afa7fe2f2fe7d8881d63a97ed706c2107f69813f896744e7d9",
            "architecture": "x86_64"
          },
          {
            "platform": "macos-arm64",
            "asset_name": "OhMyMeme-v0.6.3-arm64.dmg",
            "asset_url": "https://example.invalid/releases/0.6.3/OhMyMeme-v0.6.3-arm64.dmg",
            "sha256": "a68770266a038aef5aa327e42a378e6282721aeac8886b413b5a911f17ecbecc",
            "architecture": "arm64"
          },
          {
            "platform": "macos-x86_64",
            "asset_name": "OhMyMeme-v0.6.3-x86_64.dmg",
            "asset_url": "https://example.invalid/releases/0.6.3/OhMyMeme-v0.6.3-x86_64.dmg",
            "sha256": "d2ffbc69868a6e531f258b653d2faa3fa9edafe5913d28ccb8dfd07a29418940",
            "architecture": "x86_64"
          }
        ]
      },
      {
        "version": "0.6.2",
        "channel": "stable",
        "prerelease": false,
        "assets": [
          {
            "platform": "windows-x86_64",
            "asset_name": "OhMyMeme-0.6.2-setup.exe",
            "asset_url": "https://example.invalid/releases/0.6.2/OhMyMeme-0.6.2-setup.exe",
            "sha256": "4b030cfbcd977b3b405e44264e41702f8210969676fede3e574ea25a3c393bb6",
            "architecture": "x64"
          },
          {
            "platform": "linux-x86_64-appimage",
            "asset_name": "OhMyMeme-v0.6.2-x86_64.AppImage",
            "asset_url": "https://example.invalid/releases/0.6.2/OhMyMeme-v0.6.2-x86_64.AppImage",
            "sha256": "c1f667380e2686ec72752f2caf8aa4ab87eb8dc51f8e58c6c5ea57e13d7524fb",
            "architecture": "x86_64"
          },
          {
            "platform": "linux-x86_64-deb",
            "asset_name": "OhMyMeme-v0.6.2-amd64.deb",
            "asset_url": "https://example.invalid/releases/0.6.2/OhMyMeme-v0.6.2-amd64.deb",
            "sha256": "67c03c651d9674457cfe27f60b4606edbf378a96d51cf49b68c1dc590922a279",
            "architecture": "amd64"
          },
          {
            "platform": "linux-x86_64-rpm",
            "asset_name": "OhMyMeme-v0.6.2-x86_64.rpm",
            "asset_url": "https://example.invalid/releases/0.6.2/OhMyMeme-v0.6.2-x86_64.rpm",
            "sha256": "e3b55c66ce9d25fe7598e5c1ff6fa7a8cf0a009ef07d6f6845cf3ec1103104dd",
            "architecture": "x86_64"
          },
          {
            "platform": "macos-arm64",
            "asset_name": "OhMyMeme-v0.6.2-arm64.dmg",
            "asset_url": "https://example.invalid/releases/0.6.2/OhMyMeme-v0.6.2-arm64.dmg",
            "sha256": "39cd9a689311c08265c1f7b744574f6b7210795af72c7253a77d2b2cb0b07a01",
            "architecture": "arm64"
          },
          {
            "platform": "macos-x86_64",
            "asset_name": "OhMyMeme-v0.6.2-x86_64.dmg",
            "asset_url": "https://example.invalid/releases/0.6.2/OhMyMeme-v0.6.2-x86_64.dmg",
            "sha256": "25b2219bfe1cf95c647e7f59a6401a113b7c54ba4952132c45a0557e9b8edcad",
            "architecture": "x86_64"
          }
        ]
      }
    ],
    "ignored_releases": [
      {
        "version": "0.6.4-nightly",
        "channel": "nightly",
        "prerelease": true,
        "updater_selectable": false,
        "assets": [
          {
            "asset_name": "OhMyMeme-nightly-setup.exe",
            "asset_url": "https://example.invalid/releases/nightly/OhMyMeme-nightly-setup.exe",
            "sha256": "aaaaaaaaaaaaaaaaaaaaaaaaaaaaaaaaaaaaaaaaaaaaaaaaaaaaaaaaaaaaaaaa"
          }
        ]
      }
    ],
    "target_matrix": [
      {
        "target": "windows-x64",
        "candidate_input": {
          "version": "0.6.3",
          "asset_name": "OhMyMeme-0.6.3-setup.exe",
          "asset_url": "https://example.invalid/releases/0.6.3/OhMyMeme-0.6.3-setup.exe",
          "sha256": "102e01e382b2efb94ba4edd0ef57441b890d20ec5863896857835bb699b8ddca"
        },
        "rollback_input": {
          "version": "0.6.2",
          "asset_name": "OhMyMeme-0.6.2-setup.exe",
          "asset_url": "https://example.invalid/releases/0.6.2/OhMyMeme-0.6.2-setup.exe",
          "sha256": "4b030cfbcd977b3b405e44264e41702f8210969676fede3e574ea25a3c393bb6"
        }
      },
      {
        "target": "linux-appimage-x64",
        "candidate_input": {
          "version": "0.6.3",
          "asset_name": "OhMyMeme-v0.6.3-x86_64.AppImage",
          "asset_url": "https://example.invalid/releases/0.6.3/OhMyMeme-v0.6.3-x86_64.AppImage",
          "sha256": "18dbe3e430c2ed204f2feffc0bd4cab2ffda10aa9bb7bf98a16c18aee3e2c180"
        },
        "rollback_input": {
          "version": "0.6.2",
          "asset_name": "OhMyMeme-v0.6.2-x86_64.AppImage",
          "asset_url": "https://example.invalid/releases/0.6.2/OhMyMeme-v0.6.2-x86_64.AppImage",
          "sha256": "c1f667380e2686ec72752f2caf8aa4ab87eb8dc51f8e58c6c5ea57e13d7524fb"
        }
      },
      {
        "target": "linux-deb-amd64",
        "candidate_input": {
          "version": "0.6.3",
          "asset_name": "OhMyMeme-v0.6.3-amd64.deb",
          "asset_url": "https://example.invalid/releases/0.6.3/OhMyMeme-v0.6.3-amd64.deb",
          "sha256": "49968791855bb896d938d06f766b34ec23e69315826c37e810c9e0b8cac4f241"
        },
        "rollback_input": {
          "version": "0.6.2",
          "asset_name": "OhMyMeme-v0.6.2-amd64.deb",
          "asset_url": "https://example.invalid/releases/0.6.2/OhMyMeme-v0.6.2-amd64.deb",
          "sha256": "67c03c651d9674457cfe27f60b4606edbf378a96d51cf49b68c1dc590922a279"
        }
      },
      {
        "target": "linux-rpm-x64",
        "candidate_input": {
          "version": "0.6.3",
          "asset_name": "OhMyMeme-v0.6.3-x86_64.rpm",
          "asset_url": "https://example.invalid/releases/0.6.3/OhMyMeme-v0.6.3-x86_64.rpm",
          "sha256": "8f10ae0c5def43afa7fe2f2fe7d8881d63a97ed706c2107f69813f896744e7d9"
        },
        "rollback_input": {
          "version": "0.6.2",
          "asset_name": "OhMyMeme-v0.6.2-x86_64.rpm",
          "asset_url": "https://example.invalid/releases/0.6.2/OhMyMeme-v0.6.2-x86_64.rpm",
          "sha256": "e3b55c66ce9d25fe7598e5c1ff6fa7a8cf0a009ef07d6f6845cf3ec1103104dd"
        }
      },
      {
        "target": "macos-arm64",
        "candidate_input": {
          "version": "0.6.3",
          "asset_name": "OhMyMeme-v0.6.3-arm64.dmg",
          "asset_url": "https://example.invalid/releases/0.6.3/OhMyMeme-v0.6.3-arm64.dmg",
          "sha256": "a68770266a038aef5aa327e42a378e6282721aeac8886b413b5a911f17ecbecc"
        },
        "rollback_input": {
          "version": "0.6.2",
          "asset_name": "OhMyMeme-v0.6.2-arm64.dmg",
          "asset_url": "https://example.invalid/releases/0.6.2/OhMyMeme-v0.6.2-arm64.dmg",
          "sha256": "39cd9a689311c08265c1f7b744574f6b7210795af72c7253a77d2b2cb0b07a01"
        }
      },
      {
        "target": "macos-x86_64",
        "candidate_input": {
          "version": "0.6.3",
          "asset_name": "OhMyMeme-v0.6.3-x86_64.dmg",
          "asset_url": "https://example.invalid/releases/0.6.3/OhMyMeme-v0.6.3-x86_64.dmg",
          "sha256": "d2ffbc69868a6e531f258b653d2faa3fa9edafe5913d28ccb8dfd07a29418940"
        },
        "rollback_input": {
          "version": "0.6.2",
          "asset_name": "OhMyMeme-v0.6.2-x86_64.dmg",
          "asset_url": "https://example.invalid/releases/0.6.2/OhMyMeme-v0.6.2-x86_64.dmg",
          "sha256": "25b2219bfe1cf95c647e7f59a6401a113b7c54ba4952132c45a0557e9b8edcad"
        }
      }
    ]
  },
  "frozen_plugin_update": {
    "channel": "stable",
    "version": "0.6.3",
    "atomic": true,
    "activation_after_verify": true,
    "host_manifest": {
      "path": "ohmymeme/config/plugin-manifest.json",
      "sha256": "d39856002f56a78347f5a337113e280a08ab94a74537d841e398e84d3b4087a2"
    },
    "plugins": [
      {
        "id": "source.qqnt",
        "package_root": "ohmymeme_plugin_qqnt",
        "api_version": 1,
        "module_path": "plugins/source.qqnt/src/ohmymeme_plugin_qqnt/__init__.py",
        "frozen_path": "ohmymeme_plugin_qqnt/__init__.py",
        "sha256": "67b05f5b1cc9faa653cb17d09f68fa8a788c9ec61d3ef47164a936693995df4d"
      },
      {
        "id": "source.telegram",